{
  "protocol": "laraplate-machine/1",
  "message_id": "0192f1c4-7a2e-7c1b-9f00-3b2d5e6a7c20",
  "source_seq": 1843,
  "sent_at": "2026-10-05T08:16:02.120Z",
  "devices": [
    {
      "device": "press-07",
      "type": "data",
      "samples": [
        {
          "signal": "good_count",
          "ts": "2026-10-05T08:16:01.950Z",
          "value": 15231
        }
      ]
    }
  ],
  "losses": [
    {
      "priority": "bulk",
      "from_ts": "2026-10-05T08:10:00.000Z",
      "to_ts": "2026-10-05T08:12:30.500Z",
      "samples": 120,
      "reason": "buffer_full"
    },
    {
      "priority": "critical",
      "from_ts": "2026-10-05T08:13:00Z",
      "to_ts": "2026-10-05T08:13:05Z",
      "samples": 1,
      "reason": "rejected_invalid"
    }
  ]
}
